season,episode,name,date,total_votes,average_rating,rank,trend
1,684,Daishuuketsu! Luffy to Kyouaku Senshi Gundan,2015,263,8.3,"52,226",11
1,685,Kaishingeki! Luffy Gundan vs Pica!,2015,290,8.5,"46,770",25
1,686,Shougeki Kokuhaku! Law Atsuki Tamashii no Chikai!,2015,281,8.4,"48,728",20
1,687,Daigekitotsu! Sanbou Souchou Sabo vs Taishou Fujitora,2015,377,8.8,"36,510",36
1,688,Zettaizetsumei: Wana ni Kakatta Luffy!,2015,276,8.3,"50,319",11
1,689,Daidasshutsu! Luffy Kishikaisei no Elephant Gun,2015,284,8.4,"48,305",20
1,690,Kyoudousensen: Luffy Shouri e no Toppakou,2015,241,7.9,"59,893",10
1,691,Futarime no Samurai: Yuudachi Kanjuurou Toujou,2015,237,8.0,"59,547",11
1,692,Funtou to no Pica: Zoro Ichi Todome no Ichigeki,2015,346,8.6,"40,245",36
1,693,Kobito no Hime: Toraware no Mansherry,2015,237,7.9,"60,680",10
1,694,Fujimi! Kyoufu no Atamawari Ningyou Gundan,2015,237,7.8,"61,815",10
1,695,Inochi Kakete! Luffy wa Shouri no Kirifuda,2015,286,8.5,"47,254",20
1,696,Namida no Saikai: Rebecca to Kyros,2015,349,8.7,"39,295",36
1,697,Ichigeki Hissatsu: Dressrosa o Sukuu Otoko,2015,407,9.0,"33,202",35
1,698,Ikari Bakuhatsu: Luffy Law Saikyou no Hisaku,2015,596,9.3,"23,486",38
1,699,Kedakaki Ichizoku! Doflamingo no Shoutai!,2015,403,9.1,"32,919",34
1,700,Kyuukyoku no Chikara: Op-Op no Jitsu no Himitsu!,2015,378,8.9,"35,785",34
1,701,Kanashiki Kioku: Shiroi Machi no Shounen Law!,2015,404,9.0,"33,395",36
1,702,Tenryuubito! Doffy no Souzetsu Naru Kako,2015,406,9.0,"33,266",36
1,703,Kunan no Michi: Law to Corazon Inochi no Tabi,2015,515,9.3,"26,401",38
1,704,Toki Sameru! Op-Op no Mi o Ubae!,2015,440,9.1,"30,799",37
1,705,Kakugo no Toki: Corazon Wakare no Egao!,2015,476,9.2,"28,531",37
1,706,Yuke Law: Yasashiki Otoko Saigo no Tatakai!,2015,821,9.5,"16,937",49
1,707,Jiyuu e! Law Injection Shot Sakuretsu,2015,290,8.5,"46,769",20
1,708,Atsuki Tatakai: Law vs Doflamingo,2015,425,9.1,"31,620",38
1,709,Kanbu Kessen: Hokori Takaki Hajrudin,2015,264,8.3,"52,077",10
1,710,Ai no Kessen: Shintouryou Sai tai Baby 5,2015,284,8.5,"47,479",24
1,711,Otoko no Iji: Bellamy Saigo no Totsugeki!,2015,276,8.4,"49,396",19
1,712,Shippuudotou: Hakuba tai Dellinger,2015,309,8.6,"43,867",35
1,713,Baribari: Homage Shinken Hatsudou!,2015,354,8.8,"38,221",33
1,714,Iyashi no Hime: Mansherry o Sukue!,2015,258,8.3,"52,976",10
1,715,Otoko no Kettou: Senor Ai no Banka,2015,392,9.0,"34,235",33
1,716,Shi no Hoshikuzu: Diamante Moukou no Arashi,2015,369,8.8,"37,086",33
1,717,Trueno Bastardo: Kyros Ikari no Ichigeki,2015,356,8.8,"38,055",33
1,718,Daichi Oudan: Kyozou Pica Kishuu Sakusen!,2015,344,8.7,"39,726",35
1,719,Kuuchuu Kessen: Zoro Shin Hissastsu Ougi Sakuretsu!,2015,801,9.4,"17,682",38
1,720,Abayo! Bellamy Wakare no Ichigeki!,2015,375,8.9,"35,996",33
1,721,Law Shisu: Luffy Fundo no Moukougeki!,2015,375,8.9,"35,997",33
1,722,Shuunen no Yaiba: Gyakushuu no Gamma Knife!,2015,408,9.1,"32,627",35
1,723,Haki Gekitotsu: Luffy tai Doflamingo,2015,744,9.4,"19,037",40
1,724,Kougeki Funou: Trebol Shougeki no Himitsu,2015,371,8.9,"36,316",33
1,725,Ikari Bakuhatsu: Ore ga Zenbu Hikiukeru,2016,491,9.2,"27,862",36
1,726,Gear Fourth! Kyoui no Bounce Man!,2016,"1,015",9.4,"13,991",39
1,727,Daigyakushuu! Doflamingo no Kakusei!,2016,372,8.8,"36,845",33
1,728,Luffy! Konshin no Leo Bazooka,2016,555,9.2,"25,331",35
1,729,Kaen Ryuuou: Luffy no Inochi o Mamorinuke,2016,374,8.8,"36,702",33
1,730,Kiseki no Namida: Mansherry no Tatakai!,2016,260,8.2,"53,617",10
1,731,Inochi no Kagiri: Shi no Tori Kago o Tomero!,2016,237,7.9,"60,667",9
1,732,Sei ka Shi ka: Unmei no Countdown,2016,283,8.4,"48,468",19
1,733,Ten o Utsu: Luffy Ikari no King Kong Gun,2016,605,9.2,"23,604",35
1,734,Jiyuu e! Yorokobi no Dressrosa!,2016,245,8.0,"58,137",10
1,735,Zendaimimon: Taishou Fujitora Shougeki no Ketsudan!,2016,338,8.6,"41,015",35
1,736,Gekishin Hashiru: Ugokidasu Saiaku no Sedai!,2016,400,9.0,"33,662",34
1,737,Densetsu Tanjou: Kakumei Senshi Sabo no Bouken!,2016,352,8.8,"38,389",36
1,738,Kyoudai no Kizuna: Luffy Sabo Saikai Hiwa,2016,374,8.9,"36,095",34
1,739,Saikyou no Seibutsu: Yonkou - Hyakujuu no Kaidou,2016,527,9.2,"26,380",37
1,740,Fujitora Ugoku: Mugiwara no Ichimi Kanzen Houimou,2016,263,8.3,"52,225",11
1,741,Hijoujitai: Sarawareta Rebecca!,2016,262,8.2,"53,282",11
1,742,Oyako no Kizuna: Kyros to Rebecca!,2016,237,8.0,"59,540",11
1,743,Otoko no Iji: Luffy tai Fujitora Makkou Shoubu,2016,387,9.0,"34,567",35
1,744,Nigeba Nashi: Taishou Fujitora Hijou no Tsuigeki!,2016,401,9.1,"33,030",35
1,745,Kobun no Sakazuki: Kessei! Mugiwara Daisendan!,2016,426,9.1,"31,560",36
1,746,Gun'yuukakyo: Arekuruu Shinsekai no Kaibutsu-tachi,2016,363,8.9,"36,898",34
1,747,Gin no Yousai: Luffy to Barto Daibouken,2016,168,7.1,"87,431",3
1,748,Chika Meikyuu: Luffy tai Torokko Ningen,2016,170,6.7,"93,272",3
1,749,Kengi Hakunetsu: Law Zoro Tsui ni Kenzan!,2016,169,6.9,"90,278",3
1,750,Zettaizetsumei: Luffy Kyokugen no Shakunetsu Kessen,2016,167,7.1,"87,764",3
1,751,Bouken Kaimaku: Maboroshi no Shima &quot;Zou&quot; Touchaku!,2016,172,7.4,"81,981",3
1,752,Shin Shichi Bukai: Densetsu Shirohige no Musuko Toujou,2016,182,8.1,"70,772",4
1,753,Kesshi no Tozou: Kyozou no Se no Daibouken!,2016,177,7.7,"76,898",3
1,754,Sentou Kaishi: Luffy vs Mink-zoku!,2016,173,7.9,"75,561",4
1,755,Garchuu! Mugiwara no Ichimi Saishuuketsu,2016,176,7.7,"77,145",3
1,756,Hangeki Kaishi: Guruwara no Ichimi Daikatsuyaku!,2016,174,7.8,"76,455",3
1,757,Kyoui Shuurai: Hyakujuu Kaizokudan Jack!,2016,177,7.9,"74,488",4
1,758,Hiru no Ou: Inuarashi Koushaku Toujou!,2016,180,7.9,"73,732",4
1,759,Yoru no Ou: Nekomamushi no Danna Kenzan,2016,219,8.3,"59,784",4
1,760,Shuto Kaimetsu: Guruware no Ichimi Jouriku!,2016,218,8.3,"59,990",4
1,761,Limit Semaru: Mink-zoku to Ichimi no Kizuna!,2016,219,8.1,"61,984",4
1,762,Akudou Kikyou: Yonkou Big Mom no Shikaku,2016,234,8.4,"55,978",15
1,763,Shissou no Shinjitsu: Sanji Kyougaku no Shoutaijou,2016,308,8.6,"43,969",35
1,764,Yarou Domo e: Sanji Wakare no Okitegami,2016,327,8.7,"41,358",36
1,765,Nekomamushi no Danna ni Ai ni Ikou,2016,200,7.7,"71,070",4
1,766,Luffy Ketsudan: Sanji Dattai no Kiki!,2016,239,8.3,"56,106",6
1,767,Isshokusokuhatsu: Inu to Neko to Samurai!,2016,399,9.0,"33,719",35
1,768,Sanninme! Ninja Kiri no Raizou Toujou,2016,243,8.3,"55,369",6
1,769,Akai Ishi! &quot;One Piece&quot; e no Michishirube,2016,365,8.8,"37,407",33
1,770,Wano Kuni no Himitsu: Kouzuki-ke to Rekishi no Ponegliffs,2016,370,9.0,"35,752",33
1,771,Okoto no Chikai: Luffy to Kouzuki Momonosuke,2017,182,8.1,"70,778",4
1,772,Densetsu no Koukai: Inu to Neko to Kaizokuou!,2017,180,8.1,"71,311",4
1,773,Akumu Futatabi: Fujimi no Jack Kyoushuu,2017,177,8.2,"70,945",4
1,774,Zou Boueisen: Luffy to Zunesha!,2017,176,8.1,"72,369",4
1,775,Zunesha o Sukue: Mugiwara Rescue Daisakusen!,2017,174,7.5,"80,221",3
1,776,Wakare no Gezou: Sanji Dakkan no Funade!,2017,175,7.9,"75,020",4
1,777,Reverie e: Oujo Vivi to Shirahoshi-hime,2017,172,7.3,"83,345",3
1,778,Reverie e: Rebecca to Sakura Oukoku,2017,174,7.5,"80,222",3
1,779,Kaidou Futatabi: Kyoui Semaru Saiaku no Sedai!,2017,177,8.2,"70,946",4
1,780,Harapeko Sensen: Luffy to Kaigun Rookie!,2017,168,7.4,"83,133",3
1,781,Shuunen no 3 Nin: Mugiwara Ichimi Dai Chase!,2017,166,7.5,"82,381",3
1,782,Akuma no Kobushi: Kessen! Luffy tai Grant,2017,168,7.6,"80,614",3
1,783,Sanji Kikyou: Big Mom no Nawabari e!,2017,267,8.4,"50,698",19
1,784,Rei to Yon: Souguu! Germa Double Six,2017,268,8.4,"50,555",19
1,785,Moudoku no Kiki: Luffy to Reiju!,2017,345,8.8,"38,958",33
1,786,Totto Land! Yonkou Big Mom Toujou,2017,272,8.5,"49,070",24
1,787,Yonkou no Musume: Sanji no Fiancee Purin,2017,269,8.4,"50,388",19
1,788,Dai Shingeki! Kui Wazurai no Mom,2017,258,8.2,"53,919",10
1,789,Shuto Houkai!? Big Mom to Jinbee,2017,269,8.4,"50,389",19
1,790,Yonkou No Shiro: Whole Cake Island Touchaku,2017,266,8.4,"50,852",19
1,791,Okashi na Mori: Luffy tai Luffy!?,2017,229,7.9,"62,233",9
1,792,Mom no Shikaku: Luffy to Yuuwaku no Mori!,2017,230,8.0,"60,908",10
1,793,Kaiyuu Kokka: Germa no Ou Judge,2017,271,8.5,"49,218",19
1,794,Oyako Taiketsu: Judge tai Sanji!,2017,272,8.5,"49,067",19
1,795,Kyoudai na Yabou: Big Mom to Caesar,2017,259,8.3,"52,845",10
1,796,Tamashii no Kuni: Mom no Osorubeki Nouryoku!,2017,254,8.3,"53,574",10
1,797,Daikanbu! Sanshousei Cracker Toujou!,2017,267,8.4,"50,696",19
1,798,8 Oku no Teki: Luffy tai Senshu no Cracker,2017,313,8.7,"42,770",35
1,799,Zenryoku Shoubu: Gear Fourth tai Bisbis no Chikara,2017,329,8.8,"40,389",38
1,800,Ichi to Ni: Shuuketsu! Vinsmoke-ke,2017,324,8.8,"40,859",37
1,801,Onjin no Inochi: Sanji to Owner Zeff,2017,289,8.6,"46,070",33
1,802,Ikari no Sanji: Germa Double Six no Himitsu,2017,340,9.0,"38,093",35
1,803,Suteta Kako: Vinsmoke Sanji,2017,379,9.2,"33,952",37
1,804,East Blue e: Sanji Ketsui no Funade,2017,795,9.4,"17,817",40
1,805,Genkai Shoubu: Luffy to Mugen Biscuit,2017,364,9.1,"35,585",35
1,806,Manpuku no Chikara: Shin Gear Fourth Tan Man!,2017,513,9.3,"26,489",37
1,807,Kanashiki Kettou: Luffy tai Sanji (Zenpen),2017,446,8.9,"31,526",36
1,808,Kanashiki Kettou: Luffy tai Sanji (Kouhen),2017,"1,979",9.5,"6,090",44
1,809,Fukushuu no Arashi: Ikari no Gundan Shuurai!,2017,389,9.1,"33,819",34
1,810,Bouken no Owari: Sanji Ketsui no Propose,2017,403,9.1,"32,918",35
1,811,Koko de Matsu: Luffy tai Ikari no Gundan,2017,368,9.1,"35,307",34
1,812,Chateau Sennyuu: Ubae! Road Ponegliff,2017,365,9.1,"35,514",34
1,813,Innnen no Taimen: Luffy to Big Mom!,2017,339,9.0,"38,171",33
1,814,Tamashii no Sakebi: Brook &amp; Pedro Dengeki Sakusen,2017,352,8.9,"37,774",33
1,815,Sayonara: Purin Namida no Ketsui,2017,363,9.1,"35,642",33
1,816,Hidari Me no Innen: Pedro tai Tamago-Danshaku,2017,379,9.1,"34,543",34
1,817,Shikemoku: Sanji no Kekkon Zen'ya,2017,826,9.4,"17,152",37
1,818,Fukutsu no Soul: Brook tai Big Mom,2017,401,9.2,"32,501",37
1,819,Sora no Negai: Germa no Shippaisaku Sanji,2017,407,9.2,"32,154",34
1,820,Sanji no Moto e: Luffy Gyakushuu no Dai Gekisou!,2018,392,9.1,"33,599",34
1,821,Chateau Douran: Luffy Yakusoku no Basho e,2018,347,8.9,"38,157",33
1,822,Wakare no Ketsui: Sanji to Mugiwara Bentou,2018,272,8.4,"49,965",19
1,823,Yonkou no Negaeri: Brook Kyuushutsu Daisakusen!,2018,307,8.6,"44,062",34
1,824,"The Rendezvous! Luffy, a One-on-One at His Limit!",2018,353,8.9,"37,694",34
1,825,A Liar! Luffy and Sanji!!,2018,514,9.3,"26,450",36
1,826,Sanji Comes Back! Crash! The Tea Party from Hell!,2018,339,8.9,"38,815",33
1,827,A Secret Meeting! Luffy vs. the Fire Tank Pirates!,2018,266,8.4,"50,856",10
1,828,The Deadly Pact! Luffy &amp; Bege's Allied Forces!,2018,319,8.7,"42,161",35
1,829,Luffy Engages in a Secret Maneuver! The Wedding Full of Consp...,2018,269,8.5,"49,492",18
1,830,The Family Gets Together! The Hellish Tea Party Starts!,2018,354,8.9,"37,616",33
1,831,The Broken Couple! Sanji and Pudding Enter!,2018,270,8.5,"49,344",18
1,832,A Deadly Kiss! The Mission to Assassinate the Emperor Kicks Off!,2018,386,9.2,"33,437",34
1,833,Returning the Sake Cup! The Manly Jimbei Pays His Debt!,2018,732,9.5,"18,946",36
1,834,The Mission Failed?! The Big Mom Pirates Strike Back!,2018,335,9.1,"37,905",32
1,835,"Run, Sanji! SOS! Germa 66!",2018,333,9.0,"38,676",33
1,836,Mom's Secret! The Giant's Island Elbaph and a Little Monster!,2018,271,8.5,"49,220",17
1,837,The Birth of Mom! The Day That Carmel Vanished!,2018,332,9.0,"38,768",31
1,838,The Launcher Blasts! The Moment of Big Mom's Assassination!,2018,270,8.5,"49,343",17
1,839,The Evil Army! Transform! Germa 66!,2018,305,8.6,"44,263",33
1,840,Cutting the Father-Son Relationship! Sanji and Judge!,2018,267,8.4,"50,694",17
1,841,Escape From the Tea Party! Luffy vs. Big Mom!,2018,320,8.8,"41,312",33
1,842,The Execution Begins! Luffy's Allied Forces Are Annihilated?!&quot;,2018,323,8.9,"40,265",33
1,843,The Chateau Collapses! The Straw Hat's Great Escape Begins!,2018,272,8.5,"49,071",17
1,844,The Spear of Elbaph! Onslaught! The Flying Big Mom!,2018,260,8.3,"52,651",8
1,845,Pudding's Determination! Ablaze! The Seducing Woods!,2018,269,8.5,"49,491",17
1,846,A Lightning Counterattack! Nami and Zeus the Thundercloud!,2018,273,8.4,"49,844",18
1,847,A Coincidental Reunion! Sanji and the Lovestruck Evil Pudding!,2018,269,8.4,"50,386",17
1,848,Save the Sunny! Fighting Bravely! Chopper and Brook!,2018,271,8.4,"50,107",18
1,849,"Before the Dawn! Pedro, the Captain of the Guardians!",2018,602,9.4,"22,898",36
1,850,"I'll Be Back! Luffy, Deadly Departure!",2018,649,9.4,"21,599",36
1,851,The Man with a Bounty of Billion! The Strongest Sweet General...,2018,339,9.0,"38,169",32
1,852,A Hard Battle Starts! Luffy vs. Katakuri!,2018,349,9.1,"36,757",33
1,853,"The Green Room! An Invincible Helmsman, Jimbei!",2018,312,8.7,"42,877",34
1,854,The Threat of the Mole! Luffy's Silent Fight!,2018,335,8.9,"39,141",32
1,855,The End of the Deadly Battle?! Katakuri's Awakening in Anger!,2018,319,8.8,"41,423",34
1,856,The Forbidden Secret! Katakuri's Merienda!,2018,596,9.4,"23,088",34
1,857,Luffy Fights Back! The Invincible Katakuri's Weak Point!,2018,339,8.9,"38,813",32
1,858,Another Crisis! Gear Four vs. Unstoppable Donuts!,2018,268,8.4,"50,556",18
1,859,"The Rebellious Daughter, Chiffon! Sanji's Big Plan for Transp...",2018,233,8.0,"60,283",8
1,860,The Cake Sank?! Sanji and Bege's Getaway Battle!,2018,240,8.3,"55,933",8
1,861,The Cake Sank?! Sanji and Bege's Getaway Battle!,2018,232,8.1,"59,426",9
1,862,Sulong! Carrot's Big Mystic Transformation!,2018,432,9.1,"31,229",33
1,863,Break Through! The Straw Hat's Mighty Sea Battle!,2018,270,8.5,"49,345",18
1,864,Finally Clash - Yonko VS Straw Hat Crew,2018,328,8.9,"39,768",33
1,865,Dark King's Direct Precepts! The Battle Against Katakuri Turn...,2018,313,8.8,"42,044",34
1,866,"Finally He Returns! Sanji, the Man Who'll Stop the Emperor of...",2018,269,8.5,"49,490",19
1,867,Lurking in the Darkness! An Assassin Targeting Luffy!,2019,337,8.8,"39,661",34
1,868,One Man's Determination! Katakuri's Deadly Big Fight!,2019,921,9.4,"15,432",33
1,869,Wake Up! The Color of Observation Able to Top the Strongest!,2019,574,9.3,"24,170",34
1,870,A Fist of Divine Speed! Another Gear Four Application Activated!,2019,"2,182",9.4,"5,472",45
1,871,Finally Concluded - An Outcome of the Fierce Battle with Kata...,2019,707,9.4,"20,047",39
1,872,A Desperate Situation! The Iron-Tight Entrapment of Luffy!,2019,349,9.0,"37,403",31
1,873,Pulling Back from the Brink! The Formidable Reinforcements - ...,2019,375,9.1,"34,806",32
1,874,The Last Hope! The Sun Pirates Emerge!,2019,341,8.9,"38,633",31
1,875,A Fascinating Taste - Sanji's Cake of Happiness,2019,353,8.9,"37,695",31
1,876,"The Man of Humanity and Justice - Jinbe, a Desperate Massive ...",2019,369,9.1,"35,232",33
1,877,Time for Farewell! Pudding's One Last Request!,2019,865,9.4,"16,432",37
1,878,The World in Shock! The Fifth Emperor of the Sea Arrives!,2019,392,8.7,"36,032",37
1,879,To the Levely! Gathering of the Straw Hat Allies!,2019,199,7.9,"68,841",5
1,880,Sabo Goes into Action! All the Captains of the Revolutionary ...,2019,202,8.1,"65,726",4
1,881,Going into Action! The Implacable New Admiral of the Fleet - ...,2019,259,6.4,"76,407",4
1,882,The Paramount War! The Inherited Will of the King of the Pira...,2019,213,6.7,"81,281",3
1,883,One Step Ahead of the Dream - Shirahoshi's Path to the Sun!,2019,198,6.8,"83,399",2
1,884,I Miss Him! Vivi and Rebecca's Sentiments!,2019,199,6.8,"83,121",2
1,885,In the Dark Recesses of the Holyland! A Mysterious Giant Stra...,2019,221,7.6,"67,515",3
1,886,The Uproarious Holy Land - Princess Shirahoshi is being targe...,2019,214,7.4,"71,657",3
1,887,On the Verge - The Two Yonko Targeting Luffy,2019,345,8.6,"40,350",35
1,888,Sabo Gets Angry - Tragedy of the Revolutionary Army Officer Kuma,2019,215,8.1,"62,872",3
1,889,"Finally, It Starts! The Conspiracy-filled Reverie!",2019,211,7.9,"66,027",3
1,890,Marco! The Keeper of Whitebeard's Last Memento!,2019,198,7.7,"71,599",2
1,891,Climbing Up a Waterfall! A Great Journey Through the Land of ...,2019,448,9.1,"30,388",32
1,892,Wano Country! To the Land of Dancing Sakura and Samurai,2019,970,9.5,"14,319",40
1,893,Otama Appears! Luffy vs. Kaido's Army!,2019,560,9.2,"25,136",34
1,894,He'll Come! The Legend of Ace in the Land of Wano!,2019,585,9.3,"23,792",36
1,895,"Side Story! The World's Greatest Bounty Hunter, Cidre!",2019,181,6.5,"93,209",3
1,896,Side Story! Clash! Luffy vs. the King of Carbonation!,2019,178,6.4,"95,984",3
1,897,"Save Otama! Straw Hat, Bounding through the Wasteland!",2019,440,9.0,"31,318",34
1,898,The Headliner! Hawkings the Magician Appears!,2019,412,9.0,"32,921",35
1,899,Defeat is Inevitable! The Strawman's Fierce Attack!,2019,670,9.4,"21,008",36
1,900,The Greatest Day of My Life! Otama and Her Sweet Red-bean Soup!,2019,399,9.0,"33,718",33
1,901,Entering Enemy Territory! The Protagonists Spread into the To...,2019,285,8.3,"49,127",10
1,902,The Yokozuna Appears! The Invincible Urashima Goes After Okiku!,2019,284,8.2,"50,160",10
1,903,A Climactic Sumo Battle! Straw Hat vs. the Strongest Ever Yok...,2019,284,7.4,"58,511",9
1,904,Luffy Rages! Rescue Otama from Danger!,2019,260,7.5,"61,167",9
1,905,Fighting for Otama! Fight against Holdem!,2019,375,8.8,"36,644",36
1,906,Duel! The Magician and the Surgeon of Death!,2019,383,8.9,"35,423",36
1,907,Romance Dawn,2019,205,6.8,"81,695",3
1,908,The Coming of the Treasure Ship! Luffytaro Returns the Favor!,2019,394,8.9,"34,685",36
1,909,Nazo no Bohyo - Oden Joseki de no Saikai!,2019,467,9.2,"28,962",36
1,910,A Legendary Samurai! The Man Who Roger Admired!,2019,409,9.0,"33,092",34
1,911,Bringing Down the Emperor of the Sea! A Secret Raid Operation...,2019,354,8.6,"39,543",35
1,912,"The Strongest Man in the World! Shutenmaru, the Thieves Briga...",2019,801,9.4,"17,681",36
1,913,Everyone is Annihilated! Kaido's Furious Blast Breath!,2019,729,9.3,"19,889",37
1,914,Finally Clashing! The Ferocious Luffy vs. Kaido!,2019,"1,149",9.5,"12,108",39
1,915,Hakai-teki! Ichigeki Hissatsu no Raimei Hakke!,2019,969,9.5,"14,337",39
1,916,Iki-jigoku! Rufi Kutsujoku no Dai Tankutsu-jo,2020,509,9.0,"28,040",35
1,917,The Holyland in Tumult! Emperor of the Sea Blackbeard Cackles!,2020,705,9.2,"20,872",36
1,918,Ugokidasu - Dato Kaido Daikeikaku!,2020,384,8.6,"37,271",37
1,919,Rampage! The Prisoners - Luffy and Kid!,2020,399,8.6,"36,198",37
1,920,Dai Hyoban! Sanji no Ohako Soba!,2020,347,8.3,"42,485",12
1,921,Goka Kenran - Wano Kuni Ichi no Bijo: Komurasaki,2020,340,7.5,"50,102",9
1,922,A Tale of Chivalry! Zoro and Tonoyasu's Little Trip!,2020,405,8.6,"35,763",38
1,923,A State of Emergency! Big Mom Closes in!,2020,396,8.8,"35,133",37
1,924,The Capital in an Uproar! Another Assassin Targets Sanji!,2020,625,9.2,"23,013",38
1,925,Dashing! The Righteous Soba Mask!,2020,557,9.2,"25,250",38
1,926,Zettai Zetsumei - Kyoi no Orochi Oniwabanshu,2020,332,8.4,"43,099",21
1,927,Shura-jo! Osoreru Daija Shogun Orochi,2020,295,7.8,"52,580",10
1,928,The Flower Falls! The Final Moment of the Most Beautiful Woma...,2020,294,7.8,"52,718",10
1,929,The Bond Between Prisoners! Luffy and Old Man Hyo!,2020,295,7.8,"52,581",11
1,930,A Lead Performer! Queen the Plague Emerges!,2020,296,8.2,"48,591",12
1,931,Goes up. Luffy's Desperate Escape!,2020,289,8.0,"51,375",13
1,932,Dead or Alive! Queen's Sumo Inferno!,2020,344,8.4,"41,992",22
1,933,Gyukimaru! Zoro Fights a Duel on Bandit's Bridge,2020,500,9.0,"28,405",36
1,934,A Big Turnover! The Three-Sword Style Overcomes Danger!,2020,986,9.4,"14,381",38
1,935,"Zoro, Stunned! The Shocking Identity of the Mysterious Woman!",2020,334,8.5,"42,207",21
1,936,Get the Hang of It! The Land of Wano's Haki - Ryuo!,2020,340,8.4,"42,379",22
1,937,Tonoyasu! Ebisu's most beloved!,2020,334,8.4,"42,926",20
1,938,Shaking the nation. The identity of Ushimitsu Kozo,2020,305,8.0,"49,324",11
1,939,The Straw Hats are running! Save the captive Tonoyasu,2020,439,8.9,"31,916",35
1,940,Zoro's Fury! The Truth About the Smile!,2020,773,9.4,"18,309",38
1,941,Toko's Tears! Orochi's Pitiless Bullets!,2020,509,9.1,"27,553",35
1,942,The Straw Hats Step In! An Uproarious Deadly Battle at the Ex...,2020,471,9.0,"29,750",35
1,943,Luffy's Determination! Win Through the Sumo Inferno!,2020,436,8.9,"32,106",35
1,944,The Coming of the Storm! Big Mom's Great Rampage!,2020,359,8.3,"41,378",10
1,945,A Grudge Over Oshiruko - Luffy Gets into a Desperate Situation,2020,509,9.0,"28,039",35
1,946,Stop the Emperor of the Sea! Queen's Secret Plan!,2020,362,8.2,"41,888",11
1,947,The Ultimate Weapon! Excite Bullets Aimed at Luffy,2020,364,8.2,"41,692",11
1,948,Start Fighting Back! Luffy and the Red Scabbard Samurai!,2020,382,8.3,"39,408",11
1,949,We're Here to Win! Luffy's Desperate Scream!,2020,597,9.1,"24,261",36
1,950,Warriors' Dream! Luffy's Conquer of Udon!,2020,586,9.0,"25,106",35
1,951,Orochi's Pursuers! Ninja Army Corps vs. Zoro,2020,521,8.7,"29,015",36
1,952,Tension Rises in Onigashima! Two Emperors of the Sea Meet?!,2020,584,8.9,"25,646",34
1,953,Hiyori's Confession! Reunion on Oihagi Bridge,2020,674,8.9,"22,842",36
1,954,Its Name is Enma! Oden's Meito!,2020,704,8.7,"22,870",37
1,955,&quot;A New Alliance?! Kaido's Army Gathers&quot;,2020,818,8.3,"21,929",10
1,956,Ticking Down to the Great Battle! The Straw Hats Go into Comb...,2020,865,9.1,"17,471",38
1,957,Big News! The Warlords Attack Incident,2021,"5,257",9.4,"1,134",40
1,958,&quot;The Legendary Battle! Garp and Roger&quot;,2021,"3,143",9.4,"3,018",41
1,959,&quot;The Promised Port - Opening of Third Act of Wano Country!&quot;,2021,"1,815",9.3,"7,316",43
1,960,&quot;The Greatest Samurai of Wano Country! Kozuki Oden Appears!&quot;,2021,"1,817",9.2,"7,486",38
1,961,&quot;The Crying Apprentice! Oden and Kin'emon!&quot;,2021,"1,660",9.3,"8,231",40
1,962,Changing Destiny - The Whitebeard Pirates Cast Ashore!,2021,"1,835",9.4,"6,961",40
1,963,Oden's Determination! Whitebeard's Trials!,2021,"2,284",9.4,"5,121",41
1,964,Whitebeard's Little Brother! Oden's Great Adventure!,2021,"1,761",9.4,"7,389",39
1,965,Blades Crossed! Roger and Whitebeard!,2021,"3,459",9.5,"2,394",51
1,966,Roger's Wish! A New Journey!,2021,"2,266",9.5,"5,019",41
1,967,Devoting His Life! Roger's Adventure,2021,"2,127",9.5,"5,499",45
1,968,The Pirate King is Born: Arriving at the Last Island!,2021,"4,965",9.7,"1,121",77
1,969,To Wano Country! The Roger Pirates Disband,2021,"1,671",9.5,"7,671",41
1,970,Sad News: The Opening of the Great Pirate Era,2021,"1,398",9.4,"9,980",40
1,971,Raid! Oden and the Nine Red Scabbards,2021,"1,490",9.4,"9,197",40
1,972,The Moment of Conclusion! Oden vs. Kaido!,2021,"2,482",9.5,"4,379",44
1,973,Sentenced to Boil! Oden's Deadly Hour!,2021,"1,855",9.4,"6,831",41
1,974,Oden Wouldn't Be Oden If It Wasn't Boiled!,2021,"2,979",9.5,"3,188",52
1,975,The Castle on Fire! The Fate of the Kozuki Clan!,2021,"1,886",9.4,"6,667",41
1,976,Back to the Present Day! 20 Years Later!,2021,"1,510",9.4,"9,028",44
1,977,The Sea Is For Pirates! Raid! To Onigashima,2021,"2,099",9.4,"5,768",44
1,978,The Worst Generation Charges in! The Battle of the Stormy Sea,2021,"2,237",9.4,"5,282",44
1,979,Good Luck!? Leader Kin'emon's Plot,2021,"1,316",9.3,"10,929",41
1,980,A Tearful Promise! The Kidnapped Momonosuke!,2021,"1,147",9.4,"12,414",44
1,981,A New Member! Knight of the Sea Jinbe!,2021,"1,358",9.3,"10,575",42
1,982,Kaido's Trump Card - Introducing the Tobi Roppo,2021,"5,357",9.6,"1,012",64
1,983,The Samurai Warriors' Earnestness! The Straw Hats Land at Oni...,2021,"1,166",9.0,"13,336",42
1,984,Luffy Goes Out of Control?! Sneaking into Kaido's Banquet,2021,"1,022",8.2,"18,205",19
1,985,Thinking of O-Tama - Luffy's Furious Strike,2021,790,8.5,"21,689",36
1,986,Fighting Music! The Ability to Attack Luffy!,2021,684,8.3,"25,269",21
1,987,The Failing Dream? The Plot to Lure Sanji!,2021,672,8.8,"23,315",45
1,988,Arrival of Reinforcements! Captain of the Whitebeard Pirates!,2021,781,9.2,"18,935",45
1,989,Oath of Man! Fierce Battle of the Brachiotank,2021,677,8.9,"22,762",47
1,990,Thunder Bagua! The Appearance of Kaido's Son,2021,784,9.1,"19,293",51
1,991,Enemy or Ally? Luffy and Yamato!,2021,620,8.4,"26,769",35
1,992,Desire to be Oden! Yamato's Dream!,2021,801,9.0,"19,308",52
1,993,Explosive?! The Handcuffs that Shackle Yamato's Freedom!,2021,713,8.1,"25,416",32
1,994,The Scabbards Face-off - Kikunojo vs. Kanjuro,2021,920,9.2,"16,118",63
1,995,Raid! Inheriting Oden's Will,2021,"1,395",9.7,"9,242",163
1,996,Onigashima in Tumult! Luffy's All-Out War Begins!,2021,689,9.5,"20,132",101
1,997,"The Battle Under the Moon! The Berserker, Sulong the Moon Lion!",2021,561,9.2,"25,094",97
1,998,Zeus' Treason?! The Cornered Nami!,2021,460,9.2,"29,307",135
1,999,I'll Protect You! Yamato Meets Momonosuke!,2021,392,8.7,"36,033",241
1,1000,Episode #1.1000,2021,"1,526",9.6,"8,449",-
