season,episode,name,date,total_votes,average_rating,rank,trend
1,339,Kai Genshou Zokuzoku! Thriller Bark Jouriku,2008,224,7.8,"64,434",4
1,340,Tensai to Yobareta Otoko! Hogback Arawaru!,2008,222,7.9,"63,668",5
1,341,Nami Dai Pinch! Zombie Yashiki to Toumei Ningen,2008,229,7.9,"62,250",5
1,342,Zombie no Nazo! Akumu no Hogback Kenkyuujo,2008,220,7.8,"65,237",4
1,343,Sono Na wa Moriah! Kage o Nigiru Dai Kaizoku no Wana,2008,208,7.8,"67,942",4
1,344,Zombie Song no Kyouen! Youchi no Kane wa Yami no Oto,2008,211,7.7,"68,493",4
1,345,Doubutsu Ippai? Perona no Wonder Garden,2008,205,7.5,"72,441",4
1,346,Kieru Mugiwara Ichimi! Arawareta Nazo no Kenshi!,2008,204,7.8,"68,939",4
1,347,Nokoru Kishidou! Nami o Mamoru Uragiri Zombie,2008,206,7.8,"68,437",5
1,348,Sora kara Sanjou! Kenkyou Hanauta wa Ano Otoko!,2008,211,8.0,"64,842",5
1,349,Luffy Kinkyuujitai! Saikyou no Kage no Ikisaki,2008,212,8.0,"64,647",5
1,350,Majin to Yobareta Senshi!! Oz Fukkatsu no Toki,2008,209,8.0,"65,301",5
1,351,500-nenburi no Mezame!! Oars Kaigan!!,2008,210,7.8,"67,463",4
1,352,Shinnen no Inochigoi!! Afro o Mamoru Brook,2008,212,7.9,"65,801",5
1,353,Otoko no Chikai wa Shinazu!! Tooi Sora de Matsu Tomo e,2008,228,8.2,"59,114",5
1,354,Kanarazu Ai ni Iku!! Brook to Yakusoku no Misaki,2008,211,7.5,"71,038",4
1,355,Meshi to Nami to Kage!! Luffy Ikari no Daihangeki,2008,206,7.9,"67,199",5
1,356,Usopp Saikyou? Negative wa Makasetoke,2008,208,7.9,"66,753",5
1,357,General Zombie Shunsatsu!! Oars wa Bouken Kibun!!,2008,207,8.0,"65,750",5
1,358,Honoo no Knight Sanji!! Keritsubuse Itsuwari no Kyoshiki,2008,205,7.8,"68,675",4
1,359,Suke Suke no Innen? Ubawareta Sanji no Yume,2008,208,7.7,"69,242",4
1,360,Tasukete Hero!? Teki wa Fujimi no Princess,2008,210,8.0,"65,077",5
1,361,Perona Kyoufu!? Uso no U wa Usopp no U,2008,210,7.9,"66,273",5
1,362,Yane ni Mau Zangeki!! Kecchaku Zoro Tai Ryuuma,2008,231,8.2,"58,601",5
1,363,Chopper Gekido!! Hogback Ma no Ijutsu,2008,204,7.8,"68,938",4
1,364,Oz Hoeru!! Detekoi Mugiwara no Ichimi,2008,210,7.5,"71,297",4
1,365,Teki wa Luffy!! Saikyou Zombie Tai Mugiwara no Ichimi,2008,209,7.8,"67,701",4
1,366,Taorero Absalom!! Nami Yuujou no Raigeki!!,2008,206,7.8,"68,436",4
1,367,Ubae Down!! Hissatsu Mugiwara Docking?,2008,218,8.2,"61,074",5
1,368,Ashioto Naki Shuurai!! Nazo no Boumonsha: Boukun Kuma,2008,214,8.1,"63,116",5
1,369,Oars Plus Moriah: Chikara to Zunou no Saikyou Gattai,2008,217,8.1,"62,416",6
1,370,Gyakuten e no Hisaku: Nightmare Luffy Kenzan,2008,219,8.1,"61,989",6
1,371,"Kaimetsu, Mugiwara Ichimi: Kagekage no Chikara Zenkai",2008,218,8.2,"61,075",6
1,372,Chouzetsu Battle Start! Luffy vs Luffy,2008,398,8.8,"35,003",35
1,373,"Kecchaku Semaru! Tatakikome, Todome no Ichigeki",2008,331,8.6,"41,686",37
1,374,Karada ga Kieru! Akumu no Shima ni Sasu Asahi!,2008,251,8.4,"53,094",28
1,375,Owaranai Kiki! Mugiwara Ichimi Massatsu Shirei,2008,229,8.2,"58,938",6
1,376,Subete o Hajiku: Kuma no Nikyunikyu no Chikara,2008,440,8.9,"31,872",36
1,377,Nakama no Itami wa Waga Itami: Zoro Kesshi no Tatakai,2008,"1,480",9.6,"8,761",52
1,378,Tooi Hi no Yakusoku: Kaizoku no Uta to Chiisana Kujira,2008,237,8.2,"57,456",6
1,379,Brook no Kako: Youki na Nakama Kanashiki Wakare,2008,227,8.1,"60,367",5
1,380,Binks no Sake: Kako to Genzai o Tsunagu Uta,2008,464,9.0,"30,096",36
1,381,Arata na Nakama! Ongakuka Hanauta no Brook,2008,220,8.2,"60,649",6
1,382,Noronoro no Kyoui: Gingitsune no Foxy Futatabi,2008,192,6.7,"86,441",4
1,383,Otakara Daisoudatsusen! Houkai! Spa Island Gou,2008,194,6.7,"85,896",4
1,384,Brook's Hard Struggle the Difficult Path to Becoming a True C...,2009,198,7.5,"74,151",5
1,385,Halfway Through the Grand Line Arrival! The Red Line,2009,211,7.7,"68,490",4
1,386,Hatred of the Straw Hat Crew Enter Iron Mask Duval,2009,210,7.8,"67,468",4
1,387,The Fated Reunion! Save the Imprisoned Fishman,2009,207,7.7,"69,462",4
1,388,Tragedy! The Truth of the Unmasked Duval,2009,207,7.9,"66,963",6
1,389,Explosion! The Sunny's Super Secret Weapon Gaon Cannon,2009,208,7.9,"66,750",6
1,390,Gyojin-tou o Mezashite Jouriku: Sabaody Shotou,2009,263,7.9,"56,208",12
1,391,Bougyaku! Sabaody no Shihaisha Tenryuubito,2009,296,8.3,"47,706",13
1,392,Arata na Rival Shuuketsu! 11-nin no Choushinsei,2009,315,8.5,"43,991",21
1,393,Hyouteki wa Camie!! Semaru Hitosaraiya no Mashu,2009,304,8.3,"46,784",11
1,394,Camie o Sukue: Shotou ni Nokoru Ankoku no Rekishi,2009,297,8.3,"47,594",11
1,395,Time Limit: Human Auction Kaimaku,2009,315,8.4,"44,774",20
1,396,Tekken Sakuretsu! Auction o Buttsubuse,2009,764,9.4,"18,538",43
1,397,Dai Panic! Auction Kaijou no Shitou,2009,614,9.3,"22,939",36
1,398,Taishou Kizaru Ugoku! Souzen Sabaody Shotou,2009,404,8.8,"34,620",36
1,399,Houimou o Toppa Seyo! Kaigun Tai Sannin no Senchou,2009,393,8.7,"35,954",36
1,400,Roger to Rayleigh: Kaizoku Ou to Sono Migiude,2009,532,9.2,"26,160",35
1,401,Kaihi Fukanou!? Taishou Kizaru no Kousoku no Keri,2009,411,8.9,"33,536",35
1,402,Attouteki! Kaigun no Sentou Heiki Pacifista,2009,406,8.9,"33,879",35
1,403,Saranaru Kyouteki Arawaru! Masakari Katsuida Sentoumaru,2009,415,9.0,"32,762",36
1,404,Taishou Kizuru no Moukou Mugiwara Ichimi Zettaizetsumei!,2009,674,9.3,"21,299",43
1,405,Kesareta Nakama-tachi: Mugiwara Ichimi Saigo no Hi,2009,"1,313",9.5,"10,457",45
1,406,Jidaigeki Tokubetsu Hen: Luffy Oyabun Futatabi Kenzan,2009,191,6.2,"95,546",5
1,407,Jidaigeki Tokubetsu Hen: Yabure! Thriller Shoukai no Wana,2009,191,6.2,"95,547",5
1,408,Jouriku! Danshi Kinsei no Shima Amazon Lily,2009,269,8.0,"54,237",11
1,409,Isoge! Nakama-tachi no Moto e: Nyougashima no Bouken,2009,296,8.1,"49,515",12
1,410,Minna Meromero! Kaizoku Jotei Hancock,2009,299,8.1,"49,151",12
1,411,Senaka ni Kakusareta Himitsu: Souguu Luffy to Hebihime,2009,299,8.2,"48,180",12
1,412,Hijou no Sabaki! Ishi ni Sareta Margaret!!,2009,345,8.6,"40,348",37
1,413,Luffy Daikusen! Hebi Shimai no Haki no Chikara!!,2009,403,8.8,"34,686",37
1,414,Nouryoku Zenkai Battle!! Gomugomu Tai Hebihebi,2009,352,8.7,"39,034",37
1,415,Hancock no Kokuhaku: Shimai no Imawashiki Kako,2009,391,8.8,"35,477",37
1,416,Ace o Sukue! Arata na Mokutekichi wa Daikangoku,2009,356,8.6,"39,386",37
1,417,Koi wa Hurricane! Meromero Hancock,2009,365,8.6,"38,657",38
1,418,Nakama-tachi no Yukue: Tenkou no Kagaku to Karakurijima,2009,204,7.8,"68,940",5
1,419,Nakama-tachi no Yukue: Kyochou no Shima to Momoiro no Rakuen!,2009,204,7.5,"72,675",5
1,420,Nakama-tachi no Yukue: Shima o Tsunagu Hashi to Shokujin Shok...,2009,206,7.8,"68,438",5
1,421,Nakama-tachi no Yukue: Negative Princess to Akuma Ou,2009,205,7.8,"68,672",5
1,422,Kesshi no Sennyuu! Kaitei Kangoku Impel Down Sennyuu!,2009,214,8.0,"64,179",6
1,423,Jigoku de Saikai!? Bara Bara no Mi no Jitsuryokusha!,2009,212,8.0,"64,649",6
1,424,Yabure! Guren Jigoku: Buggy no Dohade Daisakusen,2009,208,8.0,"65,528",6
1,425,Kangoku Saikyou no Otoko! Doku Ningen Magellan Toujou,2009,209,7.9,"66,518",6
1,426,Eiga Rendou Special: Ugokidasu Kinjishi no Yabou,2009,177,7.1,"84,648",4
1,427,Eiga Rendou Special: Nerawareta Little East Blue,2009,173,6.7,"92,265",4
1,428,Eiga Rendou Special: Amigo Kaizokudan no Moukou,2009,174,6.8,"90,286",4
1,429,Eiga Rendou Special: Kessen! Luffy Tai Largo,2009,174,6.8,"90,285",6
1,430,Toraware no Ouka Shichibukai! Kaikyou no Jinbee,2009,205,7.9,"67,389",6
1,431,Roubanchou Saldeath no Wana: Level 3 Kiga Jigoku,2009,205,7.9,"67,390",6
1,432,Tokihanatareta Swan! Saikai! Bon Clay,2009,214,8.1,"63,115",7
1,433,Shochou Magellan Ugoku: Kansei! Mugiwara Houimou,2010,229,8.2,"58,939",6
1,434,Zensenryoku Shuuketsu! Level 4 Shounetsu Jigoku no Kessen,2010,214,7.9,"65,369",6
1,435,Magellan Tsuyoshi! Bon Clay Tekizen Toubou,2010,235,8.3,"56,805",7
1,436,Shiyuu Kessu! Sutemi no Luffy Saigo no Ichigeki,2010,242,8.3,"55,549",7
1,437,Dachi Dakara: Bon Clay Kesshi no Kyuushutsukou,2010,237,8.2,"57,455",7
1,438,Jigoku ni Rakuen! Impel Down Level 5.5,2010,214,7.8,"66,567",5
1,439,Luffy Chiryou Kaishi: Ivan-san Kiseki no Chikara!!,2010,210,7.6,"70,034",6
1,440,Kiseki o Shinjite! Bon Clay Tamashii no Seien,2010,215,7.8,"66,352",5
1,441,Luffy Fukkatsu! Iwa-san Datsugoku Keikaku Shidou!!,2010,219,8.1,"61,992",6
1,442,Ace Gosou Kaishi: Saikasou Level 6 no Koubou!,2010,221,8.3,"59,391",6
1,443,Saikyou Team Kessei: Shinkan! Inpel Down,2010,223,8.3,"59,018",7
1,444,Saranaru Konran! Kurohige Teach Shuurai!,2010,222,8.2,"60,246",7
1,445,Kiken na Deai! Kurohige to Ame no Shiryuu,2010,215,8.1,"62,868",6
1,446,Iji demo Taorenu! Honki no Hannyabaru,2010,245,8.4,"54,071",29
1,447,Ikari no Jet Pistol: Luffy vs Kurohige,2010,441,8.9,"31,800",37
1,448,Magellan o Tomero! Iva-san Ougi Sakuretsu,2010,215,8.1,"62,869",7
1,449,Magellan no Kisaku! Habamareta Datsugoku Keikaku,2010,219,8.2,"60,883",7
1,450,Datsugoku Team Zettaizetsumei: Kinjite &quot;Venom Demon&quot;,2010,320,8.6,"42,812",39
1,451,Okose Saigo no Kiseki: Seigi no Mon o Toppa Seyo,2010,485,9.1,"28,599",38
1,452,Mezase Kaigun Honbu: Ace Kyuushutsu e no Funade!,2010,211,8.1,"63,746",6
1,453,Nakama-tachi no Yukue: Weatheria Report to Cyborg Animal,2010,192,7.4,"76,781",5
1,454,Nakama-tachi no Yukue: Kyochou no Hina to Momoiro no Taiketsu,2010,197,6.9,"82,166",5
1,455,Nakama-tachi no Yukue: Kakumeigun to Boushoku no Mori no Wana!,2010,190,7.5,"76,004",5
1,456,Nakama-tachi no Yukue: Kyodai na Bohyou to Pantsu no On,2010,193,7.4,"76,561",5
1,457,Marineford Chokuzen Kaisou Special: Kyoudai no Chikai!,2010,194,7.4,"76,325",5
1,458,Marineford Chokuzen Kaisou Special: Shuuketsu! San Taishou,2010,218,7.2,"73,448",5
1,459,Kessen no Toki Semaru! Kaigun Saikyou no Fujin Kansei!,2010,432,8.8,"32,863",35
1,460,Kyodai Kantai Arawaru: Shuurai! Shirohige Kaizokudan,2010,464,8.9,"30,593",35
1,461,Kessen no Makuake! Ace to Shirohige no Kako,2010,543,9.1,"26,194",38
1,462,Sekai o Horobosu Chikara! Guragura no Mi no Nouryoku,2010,459,9.0,"30,334",35
1,463,Subete o Yakitsukusu!! Taishou Akainu no Chikara!,2010,490,9.1,"28,360",38
1,464,Majin no Shison! Little Oars Jr. Bakushin!,2010,447,9.0,"30,955",37
1,465,Shousha dake ga Seigi Hatsudou! Sengoku no Sakusen!,2010,477,9.1,"28,978",38
1,466,Mugiwara Team Touchaku Fuunkyuu o Tsugeru Senjou,2010,606,9.3,"23,177",37
1,467,Shinde mo Tasukeru: Luffy vs Kaigun Battle Start,2010,579,9.3,"23,996",37
1,468,Gekisen no Renzoku! Nouryokusha Gundan VS Nouryokusha Gundan,2010,489,9.2,"27,951",35
1,469,Kuma ni Okita Ihen Iva-san Ikari no Ichigeki,2010,436,8.9,"32,107",35
1,470,Kengou Mihawk Luffy ni Semaru Kokutou no Zangeki,2010,458,9.1,"29,886",36
1,471,Senmetsu Sakusen Shidou: Pacifista Gundan no Iryoku,2010,435,8.9,"32,147",34
1,472,Akainu no Bouryaku! Otoshiirerareta Shirohige,2010,446,9.0,"31,011",34
1,473,Houiheki Sadou! Shirohige Kaizokudan Zettaizetsumei!!,2010,430,9.0,"31,887",34
1,474,Shokei Shikkou Shirei Kudaru: Houiheki o Toppa Seyo!,2010,588,9.2,"24,116",35
1,475,Saishuu Kyokumen Totsunyuu! Shirohige Kishikaisei no Itte,2010,486,9.2,"28,099",35
1,476,Luffy Chikaratsuku! Oris Hiroba no Souryokusen!!,2010,460,9.0,"30,262",36
1,477,Inochi o Kezuru Chikara: Tension Hormone Futatabi,2010,436,9.0,"31,535",34
1,478,Yakusoku no Tame ni!! Gekitou! Luffy to Coby,2010,503,9.2,"27,338",36
1,479,Shokeidai Mokuzen! Hirakareta Ace e no Michi!!,2010,444,9.0,"31,119",35
1,480,Sorezore no Eranda Michi: Luffy vs Garp!,2010,619,9.3,"22,793",38
1,481,Ace Kyuushutsu! Shirohige Saigo no Senchou Meirei!,2010,807,9.4,"17,535",37
1,482,Hi o mo Yaki Tsukusu Chikara: Akainu Hijou no Tsuigeki,2011,"1,319",9.5,"10,412",42
1,483,Kotae o Sagashite: Hiken Ace Senjou ni Shisu,2011,"1,992",9.5,"6,032",47
1,484,Kaigun Honbu Houkai! Shirohige Kotobanaki Ikari!,2011,"1,093",9.5,"12,757",44
1,485,Kejime o Tsukeru: Shirohige vs Kurohige Kaizokudan,2011,"1,599",9.5,"8,181",40
1,486,Show no Kaimaku: Akasareta Kurohige no Takurami,2011,624,9.2,"23,042",37
1,487,Akainu no Shuunen! Luffy o Osou Magma no Kobushi,2011,500,9.1,"27,934",37
1,488,Hisshi no Sakebi: Unmei o Kaeru Yuuki Aru Suubyou,2011,815,9.4,"17,382",39
1,489,Shanks Kenzan! Choujou Sensou Tsui ni Shuuketsu,2011,786,9.4,"18,027",39
1,490,Gun'yuu Kakkyo Su! &quot;Atarashii Jidai&quot; no Hajimari!,2011,387,8.6,"37,032",37
1,491,Nyougashima Jouriku: Luffy o Semeru Kakoku na Genjitsu,2011,392,8.6,"36,674",37
1,492,"Saikyou Tag! Funtou, Luffy to Toriko!",2011,203,6.2,"91,957",6
1,493,Luffy to Ace: Kyoudai no Deai no Monogatari!,2011,366,8.6,"38,588",36
1,494,Sabo Toujou! Gray Terminal no Shounen,2011,321,8.5,"43,395",20
1,495,Ore wa Nigenai: Ace Kesshi no Kyuushutsu Sakusen,2011,289,8.2,"49,498",11
1,496,Itsuka Umi e! Sannin no Akudou Chikai no Sakazuki!,2011,317,8.4,"44,572",20
1,497,Dadan Ikka to no Wakare!? Kansei! Himitsu Kichi,2011,286,8.3,"48,948",11
1,498,Luffy Deshiiri!? Kaizoku Ou to Tatakatta Otoko!,2011,234,7.8,"62,440",10
1,499,Ootora to no Kessen! Senchou ni Naru no wa Dare Da!,2011,230,7.7,"64,372",10
1,500,Ubawareta Jiyuu! Sankyoudai ni Semaru Kizoku no Wana,2011,277,8.2,"51,123",11
1,501,Hanatareta Honoo: Gray Terminal no Kiki,2011,280,8.1,"51,657",11
1,502,Jiyuu wa Doko ni Aru? Shounen no Kanashiki Funade,2011,279,8.2,"50,881",11
1,503,Yoroshiku Tanomu! Kyoudai kara Todoita Tegami!,2011,414,8.9,"33,345",34
1,504,Yakusoku o Hatasu Tame: Sorezore no Tabidachi!,2011,309,8.4,"45,406",20
1,505,Aitsura ni Aitee! Luffy Namida no Sakebi,2011,401,8.8,"34,807",37
1,506,Mugiwara no Ichimi Gekishin! Motarasareta Kyouhou,2011,293,8.3,"48,053",11
1,507,Meiou Rayleigh to no Saikai: Luffy Ketsudan no Toki,2011,294,8.3,"47,934",11
1,508,Senchou no Moto e: Sorajima no Datsugoku to Fuyujima no Jiken,2011,212,7.6,"69,569",10
1,509,Sesshoku! Daikengou Mihawk: Zoro Iji no Shitou,2011,217,7.9,"64,705",11
1,510,Sanji no Junan: Oukoku e to Kikan Shita Joou!,2011,213,7.7,"68,066",10
1,511,Masaka no Saijouriku! Luffy Marineford e!,2011,229,8.1,"59,961",11
1,512,Nakama ni Todoke: Kakemeguru Dai News!,2011,229,7.9,"62,246",11
1,513,Ugokidasu Kaizoku-tachi! Kyoutendouchi no Shinsekai,2011,212,7.6,"69,570",10
1,514,Jigoku o Ikinuke: Sanji Otoko o Kaketa Shoubu,2011,210,7.4,"72,574",10
1,515,Madamada Tsuyoku Naru! Zoro Senchou e no Chikai,2011,220,7.9,"64,108",11
1,516,Luffy Shugyou Kaishi: 2-nengo ni Yakusoku no Basho de,2011,451,9.0,"30,727",37
1,517,Shinshou Kaimaku: Saishuuketsu! Mugiwara no Ichimi,2011,524,9.0,"27,408",36
1,518,Isshokusokuhatsu! Luffy Tai Nise Luffy,2011,335,8.4,"42,835",20
1,519,Kaigun Shutsudou: Nerawareta Mugiwara no Ichimi,2011,310,8.3,"46,100",11
1,520,Oomono Shuuketsu: Nise Mugiwara Ichimi no Kyoui,2011,307,8.1,"48,128",11
1,521,Sentou Kaishi! Misero Shugyou no Seika!,2011,530,9.1,"26,695",42
1,522,Zen'in Shuugou: Luffy Shinsekai e no Funade,2011,381,8.7,"36,821",37
1,523,Kyougaku no Shinjitsu: Sunny-gou o Mamotta Otoko,2011,288,8.2,"49,603",11
1,524,Kaichuu no Shitou: Arawareta Oounabara no Akuma,2011,202,7.7,"70,657",5
1,525,Shinkai de Sounan: Hagureta Mugiwara no Ichimi,2011,193,7.8,"71,587",5
1,526,Kaitei Kazan Funka! Nagasarete Gyojintou,2011,192,7.8,"71,803",4
1,527,Gyojintou Jouriku: Uruwashiki Ningyo-tachi,2011,195,7.8,"71,059",4
1,528,Koufun Bakuhatsu! Sanji Seimei no Kiki!,2011,198,7.6,"72,829",4
1,529,Gyojintou Metsubou!? Sharley no Yogen,2011,204,7.5,"72,677",4
1,530,Gyojintou no Ou: Kaishin Neptune!,2012,196,7.7,"72,033",4
1,531,Ryuuguujou! Tasuketa Same ni Tsurerarete,2012,200,7.4,"74,886",4
1,532,Yowamushi de Nakimushi! Koukakutou no Ningyo Hime,2012,195,7.5,"74,804",4
1,533,Kinkyuu Jitai Hassei: Senkyo Sareta Ryuuguujou,2012,194,7.5,"75,062",4
1,534,Ryuuguujou Gekishin! Shirahoshi Yuukai Jiken,2012,202,7.7,"70,658",4
1,535,Hody Shuurai: Fukushuu Keikaku no Hajimari,2012,192,7.5,"75,540",4
1,536,Ryuuguujou no Kessen! Zoro Tai Hody,2012,197,7.9,"69,365",5
1,537,Shirahoshi o Mamore: Decken no Tsuigeki,2012,198,7.9,"69,121",5
1,538,Ichimi Haiboku!? Hody Ryuuguujou Seiatsu,2012,194,7.8,"71,332",4
1,539,Yomigaeru Innen! Nami to Gyojin Kaizokudan!,2012,195,7.6,"73,622",4
1,540,Dorei Kaihou no Eiyuu: Boukenka Tiger,2012,208,7.8,"67,944",4
1,541,Kizaru Toujou! Tiger o Nerau Wana!,2012,216,8.2,"61,525",6
1,542,Team Kessei! Chopper o Sukue,2012,172,6.3,"99,792",5
1,543,Eiyuu no Saigo: Tiger Shougeki no Shinjitsu,2012,221,8.1,"61,584",7
1,544,Kaizokudan Bunretsu: Jinbe Tai Arlong,2012,199,7.7,"71,360",4
1,545,Yureru Gyojintou! Hyouchaku Shita Tenryuubito,2012,199,7.5,"73,922",4
1,546,Totsuzen no Higeki! Mirai o Tozasu Kyoudan,2012,200,7.9,"68,615",5
1,547,Futatabi Genzai e! Ugokidasu Hody,2012,190,7.8,"72,331",4
1,548,Oukoku Gekishin: Neptune Shokei Shirei,2012,191,7.8,"72,058",4
1,549,Shoujita Kiretsu! Luffy Tai Jinbe,2012,192,7.9,"70,603",5
1,550,Hody no Ihen: Kyouyaku no Shin no Chikara!,2012,195,7.4,"76,070",5
1,551,Kessen Hajimaru: Gyoncorde Hiroba!,2012,195,7.3,"77,343",5
1,552,Shougeki no Kokuhaku: Otohime Ansatsu no Shinjitsu,2012,197,7.4,"75,609",5
1,553,Shirahoshi no Namida! Luffy Tsui ni Toujou,2012,224,8.1,"60,953",7
1,554,Dai Gekitotsu! Mugiwara Ichimi VS 10 Man no Teki,2012,417,8.9,"33,158",38
1,555,Oowaza Sakuretsu! Zoro Sanji Shutsugeki!,2012,203,7.9,"67,895",6
1,556,Hatsu Hirou! Sunny Gou no Himitsu Heiki!,2012,197,7.7,"71,831",5
1,557,Iron Pirate! Franky Shougun Toujou,2012,194,7.6,"73,862",8
1,558,Noah Sekkin! Gyojintou Kaimetsu no Kiki!,2012,194,7.4,"76,328",6
1,559,Isoge Luffy! Shirahoshi Zettaizetsumei,2012,195,7.3,"77,344",6
1,560,Gekitou Kaishi! Luffy Tai Hody!,2012,200,7.5,"73,676",6
1,561,Dairansen! Ichimi Tai Shin Gyojin Kaizokudan!,2012,200,7.5,"73,677",6
1,562,Luffy Haiboku!? Hody Fukushuu no Toki,2012,195,7.2,"78,642",6
1,563,Shougeki no Jijitsu! Hody no Shoutai!,2012,192,7.2,"79,394",6
1,564,Zero ni! Luffy e no Atsuki Negai!,2012,193,7.4,"76,559",6
1,565,Luffy Konshin no Ichigeki! Red Hawk Sakuretsu,2012,209,7.8,"67,705",6
1,566,Tsui ni Kecchaku! Hody Saishuu Kessen,2012,191,7.7,"73,335",6
1,567,Tomare Noah! Kesshi no Elephant Gatling!,2012,200,7.6,"72,362",6
1,568,Mirai e! Taiyou e to Tsuzuku Michi!,2012,212,7.7,"68,288",7
1,569,Akasareta Himitsu: Kodai Heiki no Shinjitsu,2012,201,7.5,"73,414",6
1,570,Ichimi Kyougaku! Aratanaru Kaigun Gensui!,2012,211,8.1,"63,740",7
1,571,Okashizuki! Yonkou Big Mom,2012,200,7.9,"68,610",6
1,572,Zento Tanan: Shin Sekai ni Machiukeru Wana,2012,188,7.7,"74,109",5
1,573,Tsui ni Shukkou! Sayonara Gyojin-tou,2012,193,7.6,"74,092",5
1,574,Shin Sekai e! Saikyou no Umi o Mezashite,2012,194,7.6,"73,861",6
1,575,Z no Yabou Hen: Chiisana Kyojin Lily!,2012,174,7.2,"84,102",5
1,576,Z no Yabou Hen: Nazo no Saikyou Gundan Toujou!,2012,172,7.2,"84,664",5
1,577,Z no Yabou Hen: Kesshi no Dai Dasshutsu Sakusen!,2012,173,7.1,"85,822",5
1,578,Z no Yabou Hen: Luffy VS Shuzo!,2012,186,6.9,"85,043",5
1,579,Jouriku! Moeru Shima Punk Hazard,2013,206,7.7,"69,666",6
1,580,Shakunetsu no Tatakai! Luffy Tai Kyodai Ryuu!,2013,201,7.5,"73,413",6
1,581,Ichimi Souzen! Shougeki no Kubi dake Samurai Toujou!,2013,198,7.3,"76,649",5
1,582,Kyougaku! Tsui ni Akasareru Shima no Himitsu,2013,196,7.4,"75,835",6
1,583,Kodomo-tachi o Sukue! Ichimi Sentou Kaishi,2013,195,7.3,"77,345",6
1,584,Kenjutsu Shoubu: Brook Tai Nazo no Doutai Samurai,2013,189,7.7,"73,835",6
1,585,Shichibukai! Trafalgar Law,2013,202,7.8,"69,390",7
1,586,Dai Pinch: Luffy Gokkan no Mizuumi ni Shizumu,2013,195,7.8,"71,057",7
1,587,Gekitotsu! Law VS Smoker Chuujou,2013,221,8.2,"60,453",9
1,588,2 Nenburi no Saikai! Luffy to Law,2013,196,7.8,"70,841",6
1,589,Sekai Saiaku Kyoufu no Kagakusha Caesar,2013,190,7.4,"77,270",6
1,590,Jijou Saikyou Colabo VS Umi no Taishokukan,2013,211,5.9,"95,540",7
1,591,Chopper Gekido Master Hidounaru Jikken,2013,191,7.5,"75,784",6
1,592,Ichimi Massatsu! Densetsu no Koroshiya Raishuu!,2013,193,7.3,"77,842",6
1,593,Nami o Sukue! Luffy Yukiyama no Tatakai,2013,190,7.7,"73,599",6
1,594,Kessei! Luffy-Law Kaizoku Doumei!,2013,199,7.8,"70,114",7
1,595,Master o Toraero: Kaizoku Doumei Sakusen Kaishi!,2013,190,7.5,"76,008",6
1,596,Zenmetsu no Kiki: Shi no Monster Hirai,2013,190,7.5,"76,009",6
1,597,Dai-Gekisen: Caesar Shin no Nouryoku Hatsudou!,2013,190,8.0,"69,874",8
1,598,Honoo Kirisaku Samurai! Kitsunebi no Kin'emon!,2013,188,7.6,"75,289",6
1,599,Shougeki! Nazo no Otoko Vergo no Shoutai!,2013,192,7.7,"73,032",6
1,600,Kodomo-tachi o Mamore! Semaru Master no Ma no Te,2013,192,7.4,"76,784",6
1,601,Shin Sekai Gekishin: Caesar Akumu no Jikken,2013,188,7.5,"76,522",5
1,602,Shijou Saiaku no Satsuriku Heiki! Shinokuni,2013,187,7.6,"75,512",5
1,603,Hangeki Kaishi! Luffy-Law Daidasshutsu,2013,188,7.8,"72,821",5
1,604,Mezase R-tou! Kaizoku Doumei Kaishingeki!,2013,185,7.6,"76,035",6
1,605,Tashigi no Namida: G-5 Kesshi no Toppa Sakusen,2013,192,7.5,"75,539",6
1,606,Uragiri no Chuujou! Kichiku no Vergo,2013,191,7.5,"75,785",6
1,607,Hakunetsu no Gekisen: Luffy VS Caesar,2013,194,8.1,"67,669",8
1,608,Yami no Kuromaku! Doflamingo Ugoku!,2013,193,7.6,"74,091",6
1,609,Luffy Toushi!? Kyoufu no Yukionna Monet!,2013,190,7.7,"73,600",6
1,610,Butsukaru Kobushi! Futari no Chuujou no Tatakai,2013,193,7.5,"75,300",5
1,611,Chiisana Dragon! Momonosuke Arawaru,2013,190,7.5,"76,010",5
1,612,Fubuki no Shitou: Mugiwara no Ichimi Tai Yukionna,2013,190,7.7,"73,601",5
1,613,Ougi Sakuretsu! Zoro Saikyou no Ittou-ryuu!,2013,330,8.6,"41,797",38
1,614,Tomodachi o Mamoru! Mocha Inochi-gake no Tousou,2013,199,7.8,"70,115",5
1,615,Chahige Hitsuu! Luffy Ikari no Ichigeki,2013,190,7.9,"71,109",6
1,616,Shougeki no Kecchaku! Smoker Tai Vergo!,2013,408,8.9,"33,721",38
1,617,Caesar Gekiha! Saikyou no Grizzly Magnum,2013,205,8.1,"65,021",6
1,618,Shuurai! Dressrosa kara no Shikaku,2013,189,7.7,"73,840",5
1,619,Ooabare! Muteki no Franky Shougun,2013,193,7.8,"71,588",5
1,620,Zettai Zetsumei! Punk Hazard Dai-Bakuhatsu,2013,201,7.9,"68,355",6
1,621,Caesar o Hokaku-seyo - General Canon Sakuretsu,2013,198,8.0,"67,861",6
1,622,Kandou no Saikai! Momonosuke to Kin'emon,2013,198,7.8,"70,342",5
1,623,Sekibetsu no Toki - Punk Hazard Shukkou!,2013,195,7.7,"72,296",5
1,624,G-5 Kaimetsu! Doflamingo Kyuushuu!,2013,252,8.3,"53,882",6
1,625,Kinpaku! Aokiji tai Doflamingo,2013,223,8.1,"61,150",6
1,626,Kieta Caesar! Kaizoku Doumei Shutsugeki,2013,173,7.1,"85,823",5
1,627,Luffy Umi ni Shisu!? Kaizoku Doumei Houkai,2014,170,7.1,"86,797",4
1,628,Daigyakuten! Sakuretsu Luffy Ikari no Tekken,2014,172,6.9,"89,297",4
1,629,Gekishin! Shinsekai Ugokasu Dai News,2014,318,8.4,"44,458",21
1,630,Bouken! Ai to Jounetsu no Kuni Dressrosa,2014,291,8.3,"48,268",11
1,631,Nekkyou Uzumaku: Corrida Colosseum,2014,307,8.4,"45,604",20
1,632,Kiken na Koi: Odoriko Violet,2014,280,8.2,"50,730",11
1,633,Saikyou no Mumei Senshi! Lucy Toujou,2014,281,8.2,"50,591",11
1,634,Kaizoku Kikoushi Cavendish,2014,280,8.3,"49,786",13
1,635,Unmei no Saikai: Hyena no Bellamy,2014,285,8.3,"49,118",13
1,636,Choushinsei! Hitokui no Bartolomeo,2014,284,8.4,"48,306",12
1,637,Gun'yuu Kakkyo! Hakunetsu no B Block!,2014,276,8.3,"50,318",11
1,638,Ichigeki Hissatsu! Kyoui no King Punch,2014,283,8.3,"49,377",11
1,639,Tougyo Shuurai! Shi no Tekkyou o Toppa Seyo,2014,275,8.2,"51,400",11
1,640,Bouken! Yousei no Shima Green Bit,2014,241,7.8,"61,052",10
1,641,Shirarezaru Sekai Tontatta Oukoku,2014,244,7.8,"60,510",10
1,642,Seiki no Bouryaku: Doflamingo Ugoku,2014,323,8.6,"42,498",37
1,643,Tenchi Yurugasu! Taishou Fujitora no Jitsuryoku,2014,339,8.6,"40,902",37
1,644,Ikari no Ichigeki! Kyojin vs Lucy,2014,284,8.3,"49,252",11
1,645,Hakai-hou Sakuretsu! Lucy Kikiippatsu,2014,243,7.8,"60,720",11
1,646,Densetsu no Kaizoku - Don Chinjao!,2014,416,8.9,"33,222",36
1,647,Hikari to Kage - Dressrosa ni Hisomu Yami!,2014,241,8.0,"58,852",12
1,648,Shutsugeki - Densetsu no Hero Usoland,2014,238,8.0,"59,377",12
1,649,Gekisen Kecchaku! Lucy VS Chinjao!,2014,335,8.6,"41,323",37
1,650,Luffy to Shukumei no Ken Toushi Rebecca,2014,276,8.3,"50,317",12
1,651,Mamorinuku! Rebecca to Omocha no Heitai,2014,269,8.3,"51,311",12
1,652,Saigo no Chou Gekisen Ku - D Block Kaisen,2014,235,7.9,"61,037",11
1,653,Kessen! Joura vs Mugiwara no Ichimi,2014,235,7.9,"61,038",11
1,654,Yoshiken! Hakuba no Cavendish,2014,273,8.3,"50,777",12
1,655,Dai Kessen! Sanji VS Doflamingo,2014,370,8.7,"37,667",37
1,656,Rebecca no Shi no Ken! Haisui no Kenbu,2014,268,8.2,"52,414",12
1,657,Saikyou no Senshi! Logan vs Rebecca,2014,235,8.0,"59,898",12
1,658,Shougeki! Omocha no Heitai no Shoutai!,2014,264,8.3,"52,079",12
1,659,Senritsu no Kako! Dressrosa no Himitsu,2014,288,8.4,"47,823",21
1,660,Akumu! Dressrosa Higeki no Ichiya,2014,288,8.5,"47,001",21
1,661,Shichibukai Taiketsu Law VS Doflamingo,2014,409,9.0,"33,091",36
1,662,Ryouyuu Aimamieru! Mugiwara to Ten Yasha,2014,399,9.0,"33,720",36
1,663,Luffy Kyougaku: Ace no Ishi o Tsugu Otoko,2014,736,9.3,"19,699",39
1,664,SOP Sakusen Kaishi: Usoland Totsugeki,2014,234,8.0,"60,085",11
1,665,Atsuki Omoi - Rebecca vs. Suleiman,2014,233,7.9,"61,439",10
1,666,Shousha Kettei!? D Block Shougeki no Ketsumatsu,2014,264,8.3,"52,078",11
1,667,Taishou no Ketsudan - Fujitora vs. Doflamingo,2014,278,8.3,"50,055",11
1,668,Kesshou Kaishi: Eiyuu Diamante Toujou,2014,265,8.2,"52,881",11
1,669,Ugoku Shiro! Saikou Kanbu Pica Shutsugen,2014,264,8.2,"53,007",11
1,670,Ryuu no Tsume Sakuretsu! Lucy Kyoui no Ichigeki!,2014,289,8.4,"47,700",20
1,671,Tatou Sugar: Kodomo no Heitai Totsugeki!,2014,262,8.3,"52,350",11
1,672,Saigo no Hikari: Warera ga Taichou no Himitsu!,2014,265,8.3,"51,904",11
1,673,Panku Ningen: Gladius Dai Bakuhatsu!,2014,260,8.2,"53,614",11
1,674,Usotsuki Usoland Tousouchuu!,2014,288,8.4,"47,821",20
1,675,Unmei no Deai: Kyros to Riku Ou,2014,324,8.6,"42,415",36
1,676,Sakusen Shippai! Eiyuu Usoland Shisu!?,2014,339,8.7,"40,170",36
1,677,Densetsu Fukkatsu! Kyros Konshin no Ichigeki,2015,482,9.1,"28,750",36
1,678,Kaken Sakuretsu! Fukkatsu Meramera no Mi no Chikara,2015,479,9.2,"28,389",36
1,679,Sassou Toujou: Kakumeigun Sanbou Souchou Sabo!,2015,328,8.6,"42,003",36
1,680,Akuma no Wana: Dressrosa Senmetsu Sakusen,2015,346,8.7,"39,536",36
1,681,Go-oku no Otoko: Nerawareta Usoland!,2015,285,8.4,"48,171",20
1,682,Tekijin Toppa: Luffy Zoro Hangeki Kaishi,2015,236,8.0,"59,715",11
1,683,Daichi Meidou: Hakai Kami Kyoudai Pica Kourin,2015,277,8.4,"49,282",20
